{
  "schemaVersion": 1,
  "processingVersion": "legacy-media-local-processing-v1",
  "repositoryCandidateManifestPayloadSha256": "ff5d893567ce99fecb25c5b3d274cc18872eb0c1f6844960846528718860a53b",
  "toolchainId": "media-toolchain-v1",
  "toolchainSha256": "a950479266bf38a18b9574c13ebf241768161db58007b9910acfe696a44b8a01",
  "semanticAssetCount": 101,
  "processedAssetCount": 101,
  "deferredAssetCount": 0,
  "records": [
    {
      "legacyContentId": "blog:gale-adaptive-multi-run-review",
      "contentId": "0087f8b0-fef8-4e96-b24a-3602109ffb7d",
      "assetId": "hero",
      "role": "hero",
      "ingestProfileId": "diagram-svg-v1",
      "status": "processed",
      "sourceSha256": "d27d994bfe003b6164bab0ba53ed9efbd15fd4005e3c88751e3fddccce31251b",
      "canonical": {
        "sha256": "d27d994bfe003b6164bab0ba53ed9efbd15fd4005e3c88751e3fddccce31251b",
        "artifactRelativePath": ".local/migration/phase6/processing-artifact/canonical/0087f8b0-fef8-4e96-b24a-3602109ffb7d/hero/d27d994bfe003b6164bab0ba53ed9efbd15fd4005e3c88751e3fddccce31251b.svg",
        "format": "svg",
        "width": 1600,
        "height": 900,
        "sizeBytes": 645,
        "contentType": "image/svg+xml"
      },
      "deliveryMaster": {
        "sha256": "d27d994bfe003b6164bab0ba53ed9efbd15fd4005e3c88751e3fddccce31251b",
        "artifactRelativePath": ".local/migration/phase6/processing-artifact/canonical/0087f8b0-fef8-4e96-b24a-3602109ffb7d/hero/d27d994bfe003b6164bab0ba53ed9efbd15fd4005e3c88751e3fddccce31251b.svg",
        "format": "svg",
        "width": 1600,
        "height": 900,
        "sizeBytes": 645,
        "contentType": "image/svg+xml"
      },
      "variants": [],
      "blockers": []
    },
    {
      "legacyContentId": "blog:gale-adaptive-multi-run-review",
      "contentId": "0087f8b0-fef8-4e96-b24a-3602109ffb7d",
      "assetId": "social-card",
      "role": "social_card",
      "ingestProfileId": "diagram-svg-v1",
      "status": "processed",
      "sourceSha256": "93ab0faabb87c776ddee83fb9dd63843798f98228869648129f920b487e813c6",
      "canonical": {
        "sha256": "93ab0faabb87c776ddee83fb9dd63843798f98228869648129f920b487e813c6",
        "artifactRelativePath": ".local/migration/phase6/processing-artifact/canonical/0087f8b0-fef8-4e96-b24a-3602109ffb7d/social-card/93ab0faabb87c776ddee83fb9dd63843798f98228869648129f920b487e813c6.svg",
        "format": "svg",
        "width": 1200,
        "height": 630,
        "sizeBytes": 23597,
        "contentType": "image/svg+xml"
      },
      "deliveryMaster": {
        "sha256": "0bbcfc76cfcc104e655ffb1e871511b0a231b3703bdbc9f6a08ea522d53c3657",
        "artifactRelativePath": ".local/migration/phase6/processing-artifact/public-master/public/social-card/0bbcfc76cfcc104e655ffb1e871511b0a231b3703bdbc9f6a08ea522d53c3657.png",
        "format": "png",
        "width": 1200,
        "height": 630,
        "sizeBytes": 53077,
        "contentType": "image/png"
      },
      "variantProfileId": "social-card-v1",
      "variantManifestSha256": "3d10c2b947fe64d90df685e5be796ddc0c5a401bcb2816ab473d9e8539f37e5a",
      "variants": [],
      "blockers": []
    },
    {
      "legacyContentId": "blog:gale-v010-alpha1-release-workflow",
      "contentId": "0f7bf754-9bfc-4e15-aa31-6988576d11fc",
      "assetId": "hero",
      "role": "hero",
      "ingestProfileId": "diagram-svg-v1",
      "status": "processed",
      "sourceSha256": "43dadaf2db56ecae38a7272f8fccd6e1e904dfed4df148f9b6b48fe4a62c8145",
      "canonical": {
        "sha256": "43dadaf2db56ecae38a7272f8fccd6e1e904dfed4df148f9b6b48fe4a62c8145",
        "artifactRelativePath": ".local/migration/phase6/processing-artifact/canonical/0f7bf754-9bfc-4e15-aa31-6988576d11fc/hero/43dadaf2db56ecae38a7272f8fccd6e1e904dfed4df148f9b6b48fe4a62c8145.svg",
        "format": "svg",
        "width": 1600,
        "height": 900,
        "sizeBytes": 648,
        "contentType": "image/svg+xml"
      },
      "deliveryMaster": {
        "sha256": "43dadaf2db56ecae38a7272f8fccd6e1e904dfed4df148f9b6b48fe4a62c8145",
        "artifactRelativePath": ".local/migration/phase6/processing-artifact/canonical/0f7bf754-9bfc-4e15-aa31-6988576d11fc/hero/43dadaf2db56ecae38a7272f8fccd6e1e904dfed4df148f9b6b48fe4a62c8145.svg",
        "format": "svg",
        "width": 1600,
        "height": 900,
        "sizeBytes": 648,
        "contentType": "image/svg+xml"
      },
      "variants": [],
      "blockers": []
    },
    {
      "legacyContentId": "blog:gale-v010-alpha1-release-workflow",
      "contentId": "0f7bf754-9bfc-4e15-aa31-6988576d11fc",
      "assetId": "social-card",
      "role": "social_card",
      "ingestProfileId": "diagram-svg-v1",
      "status": "processed",
      "sourceSha256": "2563761bc5225b9b4baa207f0e77de31a6e9ff7a7595e135358cfa63504150f2",
      "canonical": {
        "sha256": "2563761bc5225b9b4baa207f0e77de31a6e9ff7a7595e135358cfa63504150f2",
        "artifactRelativePath": ".local/migration/phase6/processing-artifact/canonical/0f7bf754-9bfc-4e15-aa31-6988576d11fc/social-card/2563761bc5225b9b4baa207f0e77de31a6e9ff7a7595e135358cfa63504150f2.svg",
        "format": "svg",
        "width": 1200,
        "height": 630,
        "sizeBytes": 25845,
        "contentType": "image/svg+xml"
      },
      "deliveryMaster": {
        "sha256": "1bfac912c4318be8ed84cd097c556dff14a1ff867fe22a8395ebbc9617752a5a",
        "artifactRelativePath": ".local/migration/phase6/processing-artifact/public-master/public/social-card/1bfac912c4318be8ed84cd097c556dff14a1ff867fe22a8395ebbc9617752a5a.png",
        "format": "png",
        "width": 1200,
        "height": 630,
        "sizeBytes": 58864,
        "contentType": "image/png"
      },
      "variantProfileId": "social-card-v1",
      "variantManifestSha256": "0ab33459ec1f97359a958e1a358c44236691ed03579efa202ef17469ef0c7d67",
      "variants": [],
      "blockers": []
    },
    {
      "legacyContentId": "blog:gale-gpu-exact-hit-compaction",
      "contentId": "1b377d7f-7e1d-43f8-a350-054d18170a7f",
      "assetId": "hero",
      "role": "hero",
      "ingestProfileId": "diagram-svg-v1",
      "status": "processed",
      "sourceSha256": "f0bacd2cb065d7a23eb77985826d82db89a8e3c2ce5b673dbf27edefbe233552",
      "canonical": {
        "sha256": "f0bacd2cb065d7a23eb77985826d82db89a8e3c2ce5b673dbf27edefbe233552",
        "artifactRelativePath": ".local/migration/phase6/processing-artifact/canonical/1b377d7f-7e1d-43f8-a350-054d18170a7f/hero/f0bacd2cb065d7a23eb77985826d82db89a8e3c2ce5b673dbf27edefbe233552.svg",
        "format": "svg",
        "width": 1600,
        "height": 900,
        "sizeBytes": 645,
        "contentType": "image/svg+xml"
      },
      "deliveryMaster": {
        "sha256": "f0bacd2cb065d7a23eb77985826d82db89a8e3c2ce5b673dbf27edefbe233552",
        "artifactRelativePath": ".local/migration/phase6/processing-artifact/canonical/1b377d7f-7e1d-43f8-a350-054d18170a7f/hero/f0bacd2cb065d7a23eb77985826d82db89a8e3c2ce5b673dbf27edefbe233552.svg",
        "format": "svg",
        "width": 1600,
        "height": 900,
        "sizeBytes": 645,
        "contentType": "image/svg+xml"
      },
      "variants": [],
      "blockers": []
    },
    {
      "legacyContentId": "blog:gale-gpu-exact-hit-compaction",
      "contentId": "1b377d7f-7e1d-43f8-a350-054d18170a7f",
      "assetId": "social-card",
      "role": "social_card",
      "ingestProfileId": "diagram-svg-v1",
      "status": "processed",
      "sourceSha256": "73779d7ebb4b90976026ac077393bf4c4c8d82d38c85b2dc542d22bdb81a9f68",
      "canonical": {
        "sha256": "73779d7ebb4b90976026ac077393bf4c4c8d82d38c85b2dc542d22bdb81a9f68",
        "artifactRelativePath": ".local/migration/phase6/processing-artifact/canonical/1b377d7f-7e1d-43f8-a350-054d18170a7f/social-card/73779d7ebb4b90976026ac077393bf4c4c8d82d38c85b2dc542d22bdb81a9f68.svg",
        "format": "svg",
        "width": 1200,
        "height": 630,
        "sizeBytes": 30995,
        "contentType": "image/svg+xml"
      },
      "deliveryMaster": {
        "sha256": "1d6dc2d29ef6c3cc524fe414371f9ea8fca6c2247ac208bc371d26fcb2ce336e",
        "artifactRelativePath": ".local/migration/phase6/processing-artifact/public-master/public/social-card/1d6dc2d29ef6c3cc524fe414371f9ea8fca6c2247ac208bc371d26fcb2ce336e.png",
        "format": "png",
        "width": 1200,
        "height": 630,
        "sizeBytes": 66710,
        "contentType": "image/png"
      },
      "variantProfileId": "social-card-v1",
      "variantManifestSha256": "57dcd7c15b2cb8e0cb1214ccfe94189c1227836257d85761f41f2d4bfd34bfbe",
      "variants": [],
      "blockers": []
    },
    {
      "legacyContentId": "blog:gale-gpu-tie-shortlist-readback",
      "contentId": "1c9315c9-55af-46c5-ab97-7a9c4fc1c613",
      "assetId": "hero",
      "role": "hero",
      "ingestProfileId": "diagram-svg-v1",
      "status": "processed",
      "sourceSha256": "d300ae8c3840d1e182e4d2b773010a7eade27da09859997f6a43ef06d1359bb1",
      "canonical": {
        "sha256": "d300ae8c3840d1e182e4d2b773010a7eade27da09859997f6a43ef06d1359bb1",
        "artifactRelativePath": ".local/migration/phase6/processing-artifact/canonical/1c9315c9-55af-46c5-ab97-7a9c4fc1c613/hero/d300ae8c3840d1e182e4d2b773010a7eade27da09859997f6a43ef06d1359bb1.svg",
        "format": "svg",
        "width": 1600,
        "height": 900,
        "sizeBytes": 648,
        "contentType": "image/svg+xml"
      },
      "deliveryMaster": {
        "sha256": "d300ae8c3840d1e182e4d2b773010a7eade27da09859997f6a43ef06d1359bb1",
        "artifactRelativePath": ".local/migration/phase6/processing-artifact/canonical/1c9315c9-55af-46c5-ab97-7a9c4fc1c613/hero/d300ae8c3840d1e182e4d2b773010a7eade27da09859997f6a43ef06d1359bb1.svg",
        "format": "svg",
        "width": 1600,
        "height": 900,
        "sizeBytes": 648,
        "contentType": "image/svg+xml"
      },
      "variants": [],
      "blockers": []
    },
    {